data/cutlass_enum_gemm.txt



=============================
  Problem ID: 1

        Provider: [1;37mCUTLASS[0m
   OperationKind: [1;37mgemm[0m
       Operation: cutlass_simt_sgemm_128x128_8x2_nn_align1

          Status: [1;37mSuccess[0m
    Verification: [1;37mON[0m
     Disposition: [0mNot run[0m

          cuBLAS: Not run

       Arguments: --gemm_kind=universal --m=1024 --n=1024 --k=1024 --A=f32:column --B=f32:column --C=f32:column --D=f32:column  \
                  --alpha=1 --beta=0 --split_k_mode=serial --split_k_slices=1 --batch_count=1 --raster_order=heuristic  \
                  --runtime_input_datatype_a=invalid --runtime_input_datatype_b=invalid --use_pdl=false --enable_sm90_mixed_dtype_shuffle_test=false  \
                  --swizzle_size=1 --op_class=simt --accum=f32 --cta_m=128 --cta_n=128 --cta_k=8 --cluster_m=1 --cluster_n=1  \
                  --cluster_k=1 --cluster_m_fallback=1 --cluster_n_fallback=1 --cluster_k_fallback=1 --stages=2 --warps_m=4  \
                  --warps_n=2 --warps_k=1 --inst_m=1 --inst_n=1 --inst_k=1 --min_cc=50 --max_cc=1024

           Bytes: 12582912  bytes
           FLOPs: 2149580800  flops
           FLOPs/Byte: 170




=============================
  Problem ID: 1

        Provider: [1;37mCUTLASS[0m
   OperationKind: [1;37mgemm[0m
       Operation: cutlass_simt_sgemm_128x128_8x2_nt_align1

          Status: [1;37mSuccess[0m
    Verification: [1;37mON[0m
     Disposition: [0mNot run[0m

          cuBLAS: Not run

       Arguments: --gemm_kind=universal --m=1024 --n=1024 --k=1024 --A=f32:column --B=f32:row --C=f32:column --D=f32:column  \
                  --alpha=1 --beta=0 --split_k_mode=serial --split_k_slices=1 --batch_count=1 --raster_order=heuristic  \
                  --runtime_input_datatype_a=invalid --runtime_input_datatype_b=invalid --use_pdl=false --enable_sm90_mixed_dtype_shuffle_test=false  \
                  --swizzle_size=1 --op_class=simt --accum=f32 --cta_m=128 --cta_n=128 --cta_k=8 --cluster_m=1 --cluster_n=1  \
                  --cluster_k=1 --cluster_m_fallback=1 --cluster_n_fallback=1 --cluster_k_fallback=1 --stages=2 --warps_m=4  \
                  --warps_n=2 --warps_k=1 --inst_m=1 --inst_n=1 --inst_k=1 --min_cc=50 --max_cc=1024

           Bytes: 12582912  bytes
           FLOPs: 2149580800  flops
           FLOPs/Byte: 170




=============================
  Problem ID: 1

        Provider: [1;37mCUTLASS[0m
   OperationKind: [1;37mgemm[0m
       Operation: cutlass_simt_sgemm_128x128_8x2_tn_align1

          Status: [1;37mSuccess[0m
    Verification: [1;37mON[0m
     Disposition: [0mNot run[0m

          cuBLAS: Not run

       Arguments: --gemm_kind=universal --m=1024 --n=1024 --k=1024 --A=f32:row --B=f32:column --C=f32:column --D=f32:column  \
                  --alpha=1 --beta=0 --split_k_mode=serial --split_k_slices=1 --batch_count=1 --raster_order=heuristic  \
                  --runtime_input_datatype_a=invalid --runtime_input_datatype_b=invalid --use_pdl=false --enable_sm90_mixed_dtype_shuffle_test=false  \
                  --swizzle_size=1 --op_class=simt --accum=f32 --cta_m=128 --cta_n=128 --cta_k=8 --cluster_m=1 --cluster_n=1  \
                  --cluster_k=1 --cluster_m_fallback=1 --cluster_n_fallback=1 --cluster_k_fallback=1 --stages=2 --warps_m=4  \
                  --warps_n=2 --warps_k=1 --inst_m=1 --inst_n=1 --inst_k=1 --min_cc=50 --max_cc=1024

           Bytes: 12582912  bytes
           FLOPs: 2149580800  flops
           FLOPs/Byte: 170




=============================
  Problem ID: 1

        Provider: [1;37mCUTLASS[0m
   OperationKind: [1;37mgemm[0m
       Operation: cutlass_simt_sgemm_128x128_8x2_tt_align1

          Status: [1;37mSuccess[0m
    Verification: [1;37mON[0m
     Disposition: [0mNot run[0m

          cuBLAS: Not run

       Arguments: --gemm_kind=universal --m=1024 --n=1024 --k=1024 --A=f32:row --B=f32:row --C=f32:column --D=f32:column  \
                  --alpha=1 --beta=0 --split_k_mode=serial --split_k_slices=1 --batch_count=1 --raster_order=heuristic  \
                  --runtime_input_datatype_a=invalid --runtime_input_datatype_b=invalid --use_pdl=false --enable_sm90_mixed_dtype_shuffle_test=false  \
                  --swizzle_size=1 --op_class=simt --accum=f32 --cta_m=128 --cta_n=128 --cta_k=8 --cluster_m=1 --cluster_n=1  \
                  --cluster_k=1 --cluster_m_fallback=1 --cluster_n_fallback=1 --cluster_k_fallback=1 --stages=2 --warps_m=4  \
                  --warps_n=2 --warps_k=1 --inst_m=1 --inst_n=1 --inst_k=1 --min_cc=50 --max_cc=1024

           Bytes: 12582912  bytes
           FLOPs: 2149580800  flops
           FLOPs/Byte: 170




=============================
  Problem ID: 1

        Provider: [1;37mCUTLASS[0m
   OperationKind: [1;37mgemm[0m
       Operation: cutlass_simt_dgemm_128x128_8x2_nn_align1

          Status: [1;37mSuccess[0m
    Verification: [1;37mON[0m
     Disposition: [0mNot run[0m

          cuBLAS: Not run

       Arguments: --gemm_kind=universal --m=1024 --n=1024 --k=1024 --A=f64:column --B=f64:column --C=f64:column --D=f64:column  \
                  --alpha=1 --beta=0 --split_k_mode=serial --split_k_slices=1 --batch_count=1 --raster_order=heuristic  \
                  --runtime_input_datatype_a=invalid --runtime_input_datatype_b=invalid --use_pdl=false --enable_sm90_mixed_dtype_shuffle_test=false  \
                  --swizzle_size=1 --op_class=simt --accum=f64 --cta_m=128 --cta_n=128 --cta_k=8 --cluster_m=1 --cluster_n=1  \
                  --cluster_k=1 --cluster_m_fallback=1 --cluster_n_fallback=1 --cluster_k_fallback=1 --stages=2 --warps_m=4  \
                  --warps_n=2 --warps_k=1 --inst_m=1 --inst_n=1 --inst_k=1 --min_cc=50 --max_cc=1024

           Bytes: 25165824  bytes
           FLOPs: 2149580800  flops
           FLOPs/Byte: 85




=============================
  Problem ID: 1

        Provider: [1;37mCUTLASS[0m
   OperationKind: [1;37mgemm[0m
       Operation: cutlass_simt_dgemm_128x128_8x2_nt_align1

          Status: [1;37mSuccess[0m
    Verification: [1;37mON[0m
     Disposition: [0mNot run[0m

          cuBLAS: Not run

       Arguments: --gemm_kind=universal --m=1024 --n=1024 --k=1024 --A=f64:column --B=f64:row --C=f64:column --D=f64:column  \
                  --alpha=1 --beta=0 --split_k_mode=serial --split_k_slices=1 --batch_count=1 --raster_order=heuristic  \
                  --runtime_input_datatype_a=invalid --runtime_input_datatype_b=invalid --use_pdl=false --enable_sm90_mixed_dtype_shuffle_test=false  \
                  --swizzle_size=1 --op_class=simt --accum=f64 --cta_m=128 --cta_n=128 --cta_k=8 --cluster_m=1 --cluster_n=1  \
                  --cluster_k=1 --cluster_m_fallback=1 --cluster_n_fallback=1 --cluster_k_fallback=1 --stages=2 --warps_m=4  \
                  --warps_n=2 --warps_k=1 --inst_m=1 --inst_n=1 --inst_k=1 --min_cc=50 --max_cc=1024

           Bytes: 25165824  bytes
           FLOPs: 2149580800  flops
           FLOPs/Byte: 85




=============================
  Problem ID: 1

        Provider: [1;37mCUTLASS[0m
   OperationKind: [1;37mgemm[0m
       Operation: cutlass_simt_dgemm_128x128_8x2_tn_align1

          Status: [1;37mSuccess[0m
    Verification: [1;37mON[0m
     Disposition: [0mNot run[0m

          cuBLAS: Not run

       Arguments: --gemm_kind=universal --m=1024 --n=1024 --k=1024 --A=f64:row --B=f64:column --C=f64:column --D=f64:column  \
                  --alpha=1 --beta=0 --split_k_mode=serial --split_k_slices=1 --batch_count=1 --raster_order=heuristic  \
                  --runtime_input_datatype_a=invalid --runtime_input_datatype_b=invalid --use_pdl=false --enable_sm90_mixed_dtype_shuffle_test=false  \
                  --swizzle_size=1 --op_class=simt --accum=f64 --cta_m=128 --cta_n=128 --cta_k=8 --cluster_m=1 --cluster_n=1  \
                  --cluster_k=1 --cluster_m_fallback=1 --cluster_n_fallback=1 --cluster_k_fallback=1 --stages=2 --warps_m=4  \
                  --warps_n=2 --warps_k=1 --inst_m=1 --inst_n=1 --inst_k=1 --min_cc=50 --max_cc=1024

           Bytes: 25165824  bytes
           FLOPs: 2149580800  flops
           FLOPs/Byte: 85




=============================
  Problem ID: 1

        Provider: [1;37mCUTLASS[0m
   OperationKind: [1;37mgemm[0m
       Operation: cutlass_simt_dgemm_128x128_8x2_tt_align1

          Status: [1;37mSuccess[0m
    Verification: [1;37mON[0m
     Disposition: [0mNot run[0m

          cuBLAS: Not run

       Arguments: --gemm_kind=universal --m=1024 --n=1024 --k=1024 --A=f64:row --B=f64:row --C=f64:column --D=f64:column  \
                  --alpha=1 --beta=0 --split_k_mode=serial --split_k_slices=1 --batch_count=1 --raster_order=heuristic  \
                  --runtime_input_datatype_a=invalid --runtime_input_datatype_b=invalid --use_pdl=false --enable_sm90_mixed_dtype_shuffle_test=false  \
                  --swizzle_size=1 --op_class=simt --accum=f64 --cta_m=128 --cta_n=128 --cta_k=8 --cluster_m=1 --cluster_n=1  \
                  --cluster_k=1 --cluster_m_fallback=1 --cluster_n_fallback=1 --cluster_k_fallback=1 --stages=2 --warps_m=4  \
                  --warps_n=2 --warps_k=1 --inst_m=1 --inst_n=1 --inst_k=1 --min_cc=50 --max_cc=1024

           Bytes: 25165824  bytes
           FLOPs: 2149580800  flops
           FLOPs/Byte: 85




=============================
  Problem ID: 1

        Provider: [1;37mCUTLASS[0m
   OperationKind: [1;37mgemm[0m
       Operation: cutlass_simt_cgemm_128x64_8x2_nn_align1

          Status: [1;37mSuccess[0m
    Verification: [1;37mON[0m
     Disposition: [0mNot run[0m

          cuBLAS: Not run

       Arguments: --gemm_kind=universal --m=1024 --n=1024 --k=1024 --A=cf32:column --B=cf32:column --C=cf32:column --D=cf32:column  \
                  --alpha=1 --beta=0 --split_k_mode=serial --split_k_slices=1 --batch_count=1 --raster_order=heuristic  \
                  --runtime_input_datatype_a=invalid --runtime_input_datatype_b=invalid --use_pdl=false --enable_sm90_mixed_dtype_shuffle_test=false  \
                  --swizzle_size=1 --op_class=simt --accum=cf32 --cta_m=128 --cta_n=64 --cta_k=8 --cluster_m=1 --cluster_n=1  \
                  --cluster_k=1 --cluster_m_fallback=1 --cluster_n_fallback=1 --cluster_k_fallback=1 --stages=2 --warps_m=2  \
                  --warps_n=2 --warps_k=1 --inst_m=1 --inst_n=1 --inst_k=1 --min_cc=50 --max_cc=1024

           Bytes: 25165824  bytes
           FLOPs: 8598323200  flops
           FLOPs/Byte: 341




=============================
  Problem ID: 1

        Provider: [1;37mCUTLASS[0m
   OperationKind: [1;37mgemm[0m
       Operation: cutlass_simt_cgemm_128x64_8x2_nt_align1

          Status: [1;37mSuccess[0m
    Verification: [1;37mON[0m
     Disposition: [0mNot run[0m

          cuBLAS: Not run

       Arguments: --gemm_kind=universal --m=1024 --n=1024 --k=1024 --A=cf32:column --B=cf32:row --C=cf32:column --D=cf32:column  \
                  --alpha=1 --beta=0 --split_k_mode=serial --split_k_slices=1 --batch_count=1 --raster_order=heuristic  \
                  --runtime_input_datatype_a=invalid --runtime_input_datatype_b=invalid --use_pdl=false --enable_sm90_mixed_dtype_shuffle_test=false  \
                  --swizzle_size=1 --op_class=simt --accum=cf32 --cta_m=128 --cta_n=64 --cta_k=8 --cluster_m=1 --cluster_n=1  \
                  --cluster_k=1 --cluster_m_fallback=1 --cluster_n_fallback=1 --cluster_k_fallback=1 --stages=2 --warps_m=2  \
                  --warps_n=2 --warps_k=1 --inst_m=1 --inst_n=1 --inst_k=1 --min_cc=50 --max_cc=1024

           Bytes: 25165824  bytes
           FLOPs: 8598323200  flops
           FLOPs/Byte: 341




=============================
  Problem ID: 1

        Provider: [1;37mCUTLASS[0m
   OperationKind: [1;37mgemm[0m
       Operation: cutlass_simt_cgemm_128x64_8x2_tn_align1

          Status: [1;37mSuccess[0m
    Verification: [1;37mON[0m
     Disposition: [0mNot run[0m

          cuBLAS: Not run

       Arguments: --gemm_kind=universal --m=1024 --n=1024 --k=1024 --A=cf32:row --B=cf32:column --C=cf32:column --D=cf32:column  \
                  --alpha=1 --beta=0 --split_k_mode=serial --split_k_slices=1 --batch_count=1 --raster_order=heuristic  \
                  --runtime_input_datatype_a=invalid --runtime_input_datatype_b=invalid --use_pdl=false --enable_sm90_mixed_dtype_shuffle_test=false  \
                  --swizzle_size=1 --op_class=simt --accum=cf32 --cta_m=128 --cta_n=64 --cta_k=8 --cluster_m=1 --cluster_n=1  \
                  --cluster_k=1 --cluster_m_fallback=1 --cluster_n_fallback=1 --cluster_k_fallback=1 --stages=2 --warps_m=2  \
                  --warps_n=2 --warps_k=1 --inst_m=1 --inst_n=1 --inst_k=1 --min_cc=50 --max_cc=1024

           Bytes: 25165824  bytes
           FLOPs: 8598323200  flops
           FLOPs/Byte: 341




=============================
  Problem ID: 1

        Provider: [1;37mCUTLASS[0m
   OperationKind: [1;37mgemm[0m
       Operation: cutlass_simt_cgemm_128x64_8x2_tt_align1

          Status: [1;37mSuccess[0m
    Verification: [1;37mON[0m
     Disposition: [0mNot run[0m

          cuBLAS: Not run

       Arguments: --gemm_kind=universal --m=1024 --n=1024 --k=1024 --A=cf32:row --B=cf32:row --C=cf32:column --D=cf32:column  \
                  --alpha=1 --beta=0 --split_k_mode=serial --split_k_slices=1 --batch_count=1 --raster_order=heuristic  \
                  --runtime_input_datatype_a=invalid --runtime_input_datatype_b=invalid --use_pdl=false --enable_sm90_mixed_dtype_shuffle_test=false  \
                  --swizzle_size=1 --op_class=simt --accum=cf32 --cta_m=128 --cta_n=64 --cta_k=8 --cluster_m=1 --cluster_n=1  \
                  --cluster_k=1 --cluster_m_fallback=1 --cluster_n_fallback=1 --cluster_k_fallback=1 --stages=2 --warps_m=2  \
                  --warps_n=2 --warps_k=1 --inst_m=1 --inst_n=1 --inst_k=1 --min_cc=50 --max_cc=1024

           Bytes: 25165824  bytes
           FLOPs: 8598323200  flops
           FLOPs/Byte: 341




=============================
  Problem ID: 1

        Provider: [1;37mCUTLASS[0m
   OperationKind: [1;37mgemm[0m
       Operation: cutlass_simt_hgemm_256x128_8x2_nn_align1

          Status: [1;37mSuccess[0m
    Verification: [1;37mON[0m
     Disposition: [0mNot run[0m

          cuBLAS: Not run

       Arguments: --gemm_kind=universal --m=1024 --n=1024 --k=1024 --A=f16:column --B=f16:column --C=f16:column --D=f16:column  \
                  --alpha=1 --beta=0 --split_k_mode=serial --split_k_slices=1 --batch_count=1 --raster_order=heuristic  \
                  --runtime_input_datatype_a=invalid --runtime_input_datatype_b=invalid --use_pdl=false --enable_sm90_mixed_dtype_shuffle_test=false  \
                  --swizzle_size=1 --op_class=simt --accum=f16 --cta_m=256 --cta_n=128 --cta_k=8 --cluster_m=1 --cluster_n=1  \
                  --cluster_k=1 --cluster_m_fallback=1 --cluster_n_fallback=1 --cluster_k_fallback=1 --stages=2 --warps_m=4  \
                  --warps_n=2 --warps_k=1 --inst_m=1 --inst_n=1 --inst_k=1 --min_cc=50 --max_cc=1024

           Bytes: 6291456  bytes
           FLOPs: 2149580800  flops
           FLOPs/Byte: 341




=============================
  Problem ID: 1

        Provider: [1;37mCUTLASS[0m
   OperationKind: [1;37mgemm[0m
       Operation: cutlass_simt_hgemm_256x128_8x2_nt_align1

          Status: [1;37mSuccess[0m
    Verification: [1;37mON[0m
     Disposition: [0mNot run[0m

          cuBLAS: Not run

       Arguments: --gemm_kind=universal --m=1024 --n=1024 --k=1024 --A=f16:column --B=f16:row --C=f16:column --D=f16:column  \
                  --alpha=1 --beta=0 --split_k_mode=serial --split_k_slices=1 --batch_count=1 --raster_order=heuristic  \
                  --runtime_input_datatype_a=invalid --runtime_input_datatype_b=invalid --use_pdl=false --enable_sm90_mixed_dtype_shuffle_test=false  \
                  --swizzle_size=1 --op_class=simt --accum=f16 --cta_m=256 --cta_n=128 --cta_k=8 --cluster_m=1 --cluster_n=1  \
                  --cluster_k=1 --cluster_m_fallback=1 --cluster_n_fallback=1 --cluster_k_fallback=1 --stages=2 --warps_m=4  \
                  --warps_n=2 --warps_k=1 --inst_m=1 --inst_n=1 --inst_k=1 --min_cc=50 --max_cc=1024

           Bytes: 6291456  bytes
           FLOPs: 2149580800  flops
           FLOPs/Byte: 341




=============================
  Problem ID: 1

        Provider: [1;37mCUTLASS[0m
   OperationKind: [1;37mgemm[0m
       Operation: cutlass_simt_hgemm_256x128_8x2_tn_align1

          Status: [1;37mSuccess[0m
    Verification: [1;37mON[0m
     Disposition: [0mNot run[0m

          cuBLAS: Not run

       Arguments: --gemm_kind=universal --m=1024 --n=1024 --k=1024 --A=f16:row --B=f16:column --C=f16:column --D=f16:column  \
                  --alpha=1 --beta=0 --split_k_mode=serial --split_k_slices=1 --batch_count=1 --raster_order=heuristic  \
                  --runtime_input_datatype_a=invalid --runtime_input_datatype_b=invalid --use_pdl=false --enable_sm90_mixed_dtype_shuffle_test=false  \
                  --swizzle_size=1 --op_class=simt --accum=f16 --cta_m=256 --cta_n=128 --cta_k=8 --cluster_m=1 --cluster_n=1  \
                  --cluster_k=1 --cluster_m_fallback=1 --cluster_n_fallback=1 --cluster_k_fallback=1 --stages=2 --warps_m=4  \
                  --warps_n=2 --warps_k=1 --inst_m=1 --inst_n=1 --inst_k=1 --min_cc=50 --max_cc=1024

           Bytes: 6291456  bytes
           FLOPs: 2149580800  flops
           FLOPs/Byte: 341




=============================
  Problem ID: 1

        Provider: [1;37mCUTLASS[0m
   OperationKind: [1;37mgemm[0m
       Operation: cutlass_simt_hgemm_256x128_8x2_tt_align1

          Status: [1;37mSuccess[0m
    Verification: [1;37mON[0m
     Disposition: [0mNot run[0m

          cuBLAS: Not run

       Arguments: --gemm_kind=universal --m=1024 --n=1024 --k=1024 --A=f16:row --B=f16:row --C=f16:column --D=f16:column  \
                  --alpha=1 --beta=0 --split_k_mode=serial --split_k_slices=1 --batch_count=1 --raster_order=heuristic  \
                  --runtime_input_datatype_a=invalid --runtime_input_datatype_b=invalid --use_pdl=false --enable_sm90_mixed_dtype_shuffle_test=false  \
                  --swizzle_size=1 --op_class=simt --accum=f16 --cta_m=256 --cta_n=128 --cta_k=8 --cluster_m=1 --cluster_n=1  \
                  --cluster_k=1 --cluster_m_fallback=1 --cluster_n_fallback=1 --cluster_k_fallback=1 --stages=2 --warps_m=4  \
                  --warps_n=2 --warps_k=1 --inst_m=1 --inst_n=1 --inst_k=1 --min_cc=50 --max_cc=1024

           Bytes: 6291456  bytes
           FLOPs: 2149580800  flops
           FLOPs/Byte: 341




=============================
  Problem ID: 1

        Provider: [1;37mCUTLASS[0m
   OperationKind: [1;37mgemm[0m
       Operation: cutlass_simt_igemm_s8_128x128_32x2_nn_align1

          Status: [1;37mSuccess[0m
    Verification: [1;37mON[0m
     Disposition: [0mNot run[0m

          cuBLAS: Not run

       Arguments: --gemm_kind=universal --m=1024 --n=1024 --k=1024 --A=s8:column --B=s8:column --C=s32:column --D=s32:column  \
                  --alpha=1 --beta=0 --split_k_mode=serial --split_k_slices=1 --batch_count=1 --raster_order=heuristic  \
                  --runtime_input_datatype_a=invalid --runtime_input_datatype_b=invalid --use_pdl=false --enable_sm90_mixed_dtype_shuffle_test=false  \
                  --swizzle_size=1 --op_class=simt --accum=s32 --cta_m=128 --cta_n=128 --cta_k=32 --cluster_m=1 --cluster_n=1  \
                  --cluster_k=1 --cluster_m_fallback=1 --cluster_n_fallback=1 --cluster_k_fallback=1 --stages=2 --warps_m=4  \
                  --warps_n=2 --warps_k=1 --inst_m=1 --inst_n=1 --inst_k=4 --min_cc=50 --max_cc=1024

           Bytes: 6291456  bytes
           FLOPs: 2149580800  flops
           FLOPs/Byte: 341




=============================
  Problem ID: 1

        Provider: [1;37mCUTLASS[0m
   OperationKind: [1;37mgemm[0m
       Operation: cutlass_simt_igemm_s8_128x128_32x2_nt_align1

          Status: [1;37mSuccess[0m
    Verification: [1;37mON[0m
     Disposition: [0mNot run[0m

          cuBLAS: Not run

       Arguments: --gemm_kind=universal --m=1024 --n=1024 --k=1024 --A=s8:column --B=s8:row --C=s32:column --D=s32:column  \
                  --alpha=1 --beta=0 --split_k_mode=serial --split_k_slices=1 --batch_count=1 --raster_order=heuristic  \
                  --runtime_input_datatype_a=invalid --runtime_input_datatype_b=invalid --use_pdl=false --enable_sm90_mixed_dtype_shuffle_test=false  \
                  --swizzle_size=1 --op_class=simt --accum=s32 --cta_m=128 --cta_n=128 --cta_k=32 --cluster_m=1 --cluster_n=1  \
                  --cluster_k=1 --cluster_m_fallback=1 --cluster_n_fallback=1 --cluster_k_fallback=1 --stages=2 --warps_m=4  \
                  --warps_n=2 --warps_k=1 --inst_m=1 --inst_n=1 --inst_k=4 --min_cc=50 --max_cc=1024

           Bytes: 6291456  bytes
           FLOPs: 2149580800  flops
           FLOPs/Byte: 341




=============================
  Problem ID: 1

        Provider: [1;37mCUTLASS[0m
   OperationKind: [1;37mgemm[0m
       Operation: cutlass_simt_igemm_s8_128x128_32x2_tn_align1

          Status: [1;37mSuccess[0m
    Verification: [1;37mON[0m
     Disposition: [0mNot run[0m

          cuBLAS: Not run

       Arguments: --gemm_kind=universal --m=1024 --n=1024 --k=1024 --A=s8:row --B=s8:column --C=s32:column --D=s32:column  \
                  --alpha=1 --beta=0 --split_k_mode=serial --split_k_slices=1 --batch_count=1 --raster_order=heuristic  \
                  --runtime_input_datatype_a=invalid --runtime_input_datatype_b=invalid --use_pdl=false --enable_sm90_mixed_dtype_shuffle_test=false  \
                  --swizzle_size=1 --op_class=simt --accum=s32 --cta_m=128 --cta_n=128 --cta_k=32 --cluster_m=1 --cluster_n=1  \
                  --cluster_k=1 --cluster_m_fallback=1 --cluster_n_fallback=1 --cluster_k_fallback=1 --stages=2 --warps_m=4  \
                  --warps_n=2 --warps_k=1 --inst_m=1 --inst_n=1 --inst_k=4 --min_cc=50 --max_cc=1024

           Bytes: 6291456  bytes
           FLOPs: 2149580800  flops
           FLOPs/Byte: 341




=============================
  Problem ID: 1

        Provider: [1;37mCUTLASS[0m
   OperationKind: [1;37mgemm[0m
       Operation: cutlass_simt_igemm_s8_128x128_32x2_tt_align1

          Status: [1;37mSuccess[0m
    Verification: [1;37mON[0m
     Disposition: [0mNot run[0m

          cuBLAS: Not run

       Arguments: --gemm_kind=universal --m=1024 --n=1024 --k=1024 --A=s8:row --B=s8:row --C=s32:column --D=s32:column  \
                  --alpha=1 --beta=0 --split_k_mode=serial --split_k_slices=1 --batch_count=1 --raster_order=heuristic  \
                  --runtime_input_datatype_a=invalid --runtime_input_datatype_b=invalid --use_pdl=false --enable_sm90_mixed_dtype_shuffle_test=false  \
                  --swizzle_size=1 --op_class=simt --accum=s32 --cta_m=128 --cta_n=128 --cta_k=32 --cluster_m=1 --cluster_n=1  \
                  --cluster_k=1 --cluster_m_fallback=1 --cluster_n_fallback=1 --cluster_k_fallback=1 --stages=2 --warps_m=4  \
                  --warps_n=2 --warps_k=1 --inst_m=1 --inst_n=1 --inst_k=4 --min_cc=50 --max_cc=1024

           Bytes: 6291456  bytes
           FLOPs: 2149580800  flops
           FLOPs/Byte: 341




=============================
  Problem ID: 1

        Provider: [1;37mCUTLASS[0m
   OperationKind: [1;37mgemm[0m
       Operation: cutlass_simt_s8_igemm_s8_128x128_32x2_nn_align1

          Status: [1;37mSuccess[0m
    Verification: [1;37mON[0m
     Disposition: [0mNot run[0m

          cuBLAS: Not run

       Arguments: --gemm_kind=universal --m=1024 --n=1024 --k=1024 --A=s8:column --B=s8:column --C=s8:column --D=s8:column  \
                  --alpha=1 --beta=0 --split_k_mode=serial --split_k_slices=1 --batch_count=1 --raster_order=heuristic  \
                  --runtime_input_datatype_a=invalid --runtime_input_datatype_b=invalid --use_pdl=false --enable_sm90_mixed_dtype_shuffle_test=false  \
                  --swizzle_size=1 --op_class=simt --accum=s32 --cta_m=128 --cta_n=128 --cta_k=32 --cluster_m=1 --cluster_n=1  \
                  --cluster_k=1 --cluster_m_fallback=1 --cluster_n_fallback=1 --cluster_k_fallback=1 --stages=2 --warps_m=4  \
                  --warps_n=2 --warps_k=1 --inst_m=1 --inst_n=1 --inst_k=4 --min_cc=50 --max_cc=1024

           Bytes: 3145728  bytes
           FLOPs: 2149580800  flops
           FLOPs/Byte: 683




=============================
  Problem ID: 1

        Provider: [1;37mCUTLASS[0m
   OperationKind: [1;37mgemm[0m
       Operation: cutlass_simt_s8_igemm_s8_128x128_32x2_nt_align1

          Status: [1;37mSuccess[0m
    Verification: [1;37mON[0m
     Disposition: [0mNot run[0m

          cuBLAS: Not run

       Arguments: --gemm_kind=universal --m=1024 --n=1024 --k=1024 --A=s8:column --B=s8:row --C=s8:column --D=s8:column  \
                  --alpha=1 --beta=0 --split_k_mode=serial --split_k_slices=1 --batch_count=1 --raster_order=heuristic  \
                  --runtime_input_datatype_a=invalid --runtime_input_datatype_b=invalid --use_pdl=false --enable_sm90_mixed_dtype_shuffle_test=false  \
                  --swizzle_size=1 --op_class=simt --accum=s32 --cta_m=128 --cta_n=128 --cta_k=32 --cluster_m=1 --cluster_n=1  \
                  --cluster_k=1 --cluster_m_fallback=1 --cluster_n_fallback=1 --cluster_k_fallback=1 --stages=2 --warps_m=4  \
                  --warps_n=2 --warps_k=1 --inst_m=1 --inst_n=1 --inst_k=4 --min_cc=50 --max_cc=1024

           Bytes: 3145728  bytes
           FLOPs: 2149580800  flops
           FLOPs/Byte: 683




=============================
  Problem ID: 1

        Provider: [1;37mCUTLASS[0m
   OperationKind: [1;37mgemm[0m
       Operation: cutlass_simt_s8_igemm_s8_128x128_32x2_tn_align1

          Status: [1;37mSuccess[0m
    Verification: [1;37mON[0m
     Disposition: [0mNot run[0m

          cuBLAS: Not run

       Arguments: --gemm_kind=universal --m=1024 --n=1024 --k=1024 --A=s8:row --B=s8:column --C=s8:column --D=s8:column  \
                  --alpha=1 --beta=0 --split_k_mode=serial --split_k_slices=1 --batch_count=1 --raster_order=heuristic  \
                  --runtime_input_datatype_a=invalid --runtime_input_datatype_b=invalid --use_pdl=false --enable_sm90_mixed_dtype_shuffle_test=false  \
                  --swizzle_size=1 --op_class=simt --accum=s32 --cta_m=128 --cta_n=128 --cta_k=32 --cluster_m=1 --cluster_n=1  \
                  --cluster_k=1 --cluster_m_fallback=1 --cluster_n_fallback=1 --cluster_k_fallback=1 --stages=2 --warps_m=4  \
                  --warps_n=2 --warps_k=1 --inst_m=1 --inst_n=1 --inst_k=4 --min_cc=50 --max_cc=1024

           Bytes: 3145728  bytes
           FLOPs: 2149580800  flops
           FLOPs/Byte: 683




=============================
  Problem ID: 1

        Provider: [1;37mCUTLASS[0m
   OperationKind: [1;37mgemm[0m
       Operation: cutlass_simt_s8_igemm_s8_128x128_32x2_tt_align1

          Status: [1;37mSuccess[0m
    Verification: [1;37mON[0m
     Disposition: [0mNot run[0m

          cuBLAS: Not run

       Arguments: --gemm_kind=universal --m=1024 --n=1024 --k=1024 --A=s8:row --B=s8:row --C=s8:column --D=s8:column  \
                  --alpha=1 --beta=0 --split_k_mode=serial --split_k_slices=1 --batch_count=1 --raster_order=heuristic  \
                  --runtime_input_datatype_a=invalid --runtime_input_datatype_b=invalid --use_pdl=false --enable_sm90_mixed_dtype_shuffle_test=false  \
                  --swizzle_size=1 --op_class=simt --accum=s32 --cta_m=128 --cta_n=128 --cta_k=32 --cluster_m=1 --cluster_n=1  \
                  --cluster_k=1 --cluster_m_fallback=1 --cluster_n_fallback=1 --cluster_k_fallback=1 --stages=2 --warps_m=4  \
                  --warps_n=2 --warps_k=1 --inst_m=1 --inst_n=1 --inst_k=4 --min_cc=50 --max_cc=1024

           Bytes: 3145728  bytes
           FLOPs: 2149580800  flops
           FLOPs/Byte: 683




=============================
  Problem ID: 1

        Provider: [1;37mCUTLASS[0m
   OperationKind: [1;37mgemm[0m
       Operation: cutlass_tensorop_s1688gemm_f16_256x128_32x2_nn_align8

          Status: [1;37mSuccess[0m
    Verification: [1;37mON[0m
     Disposition: [0mNot run[0m

          cuBLAS: Not run

       Arguments: --gemm_kind=universal --m=1024 --n=1024 --k=1024 --A=f16:column --B=f16:column --C=f32:column --D=f32:column  \
                  --alpha=1 --beta=0 --split_k_mode=serial --split_k_slices=1 --batch_count=1 --raster_order=heuristic  \
                  --runtime_input_datatype_a=invalid --runtime_input_datatype_b=invalid --use_pdl=false --enable_sm90_mixed_dtype_shuffle_test=false  \
                  --swizzle_size=1 --op_class=tensorop --accum=f32 --cta_m=256 --cta_n=128 --cta_k=32 --cluster_m=1 --cluster_n=1  \
                  --cluster_k=1 --cluster_m_fallback=1 --cluster_n_fallback=1 --cluster_k_fallback=1 --stages=2 --warps_m=4  \
                  --warps_n=2 --warps_k=1 --inst_m=16 --inst_n=8 --inst_k=8 --min_cc=75 --max_cc=1024

           Bytes: 8388608  bytes
           FLOPs: 2149580800  flops
           FLOPs/Byte: 256




=============================
  Problem ID: 1

        Provider: [1;37mCUTLASS[0m
   OperationKind: [1;37mgemm[0m
       Operation: cutlass_tensorop_s1688gemm_f16_256x128_32x2_nt_align8

          Status: [1;37mSuccess[0m
    Verification: [1;37mON[0m
     Disposition: [0mNot run[0m

          cuBLAS: Not run

       Arguments: --gemm_kind=universal --m=1024 --n=1024 --k=1024 --A=f16:column --B=f16:row --C=f32:column --D=f32:column  \
                  --alpha=1 --beta=0 --split_k_mode=serial --split_k_slices=1 --batch_count=1 --raster_order=heuristic  \
                  --runtime_input_datatype_a=invalid --runtime_input_datatype_b=invalid --use_pdl=false --enable_sm90_mixed_dtype_shuffle_test=false  \
                  --swizzle_size=1 --op_class=tensorop --accum=f32 --cta_m=256 --cta_n=128 --cta_k=32 --cluster_m=1 --cluster_n=1  \
                  --cluster_k=1 --cluster_m_fallback=1 --cluster_n_fallback=1 --cluster_k_fallback=1 --stages=2 --warps_m=4  \
                  --warps_n=2 --warps_k=1 --inst_m=16 --inst_n=8 --inst_k=8 --min_cc=75 --max_cc=1024

           Bytes: 8388608  bytes
           FLOPs: 2149580800  flops
           FLOPs/Byte: 256




=============================
  Problem ID: 1

        Provider: [1;37mCUTLASS[0m
   OperationKind: [1;37mgemm[0m
       Operation: cutlass_tensorop_s1688gemm_f16_256x128_32x2_tn_align8

          Status: [1;37mSuccess[0m
    Verification: [1;37mON[0m
     Disposition: [0mNot run[0m

          cuBLAS: Not run

       Arguments: --gemm_kind=universal --m=1024 --n=1024 --k=1024 --A=f16:row --B=f16:column --C=f32:column --D=f32:column  \
                  --alpha=1 --beta=0 --split_k_mode=serial --split_k_slices=1 --batch_count=1 --raster_order=heuristic  \
                  --runtime_input_datatype_a=invalid --runtime_input_datatype_b=invalid --use_pdl=false --enable_sm90_mixed_dtype_shuffle_test=false  \
                  --swizzle_size=1 --op_class=tensorop --accum=f32 --cta_m=256 --cta_n=128 --cta_k=32 --cluster_m=1 --cluster_n=1  \
                  --cluster_k=1 --cluster_m_fallback=1 --cluster_n_fallback=1 --cluster_k_fallback=1 --stages=2 --warps_m=4  \
                  --warps_n=2 --warps_k=1 --inst_m=16 --inst_n=8 --inst_k=8 --min_cc=75 --max_cc=1024

           Bytes: 8388608  bytes
           FLOPs: 2149580800  flops
           FLOPs/Byte: 256




=============================
  Problem ID: 1

        Provider: [1;37mCUTLASS[0m
   OperationKind: [1;37mgemm[0m
       Operation: cutlass_tensorop_s1688gemm_f16_256x128_32x2_tt_align8

          Status: [1;37mSuccess[0m
    Verification: [1;37mON[0m
     Disposition: [0mNot run[0m

          cuBLAS: Not run

       Arguments: --gemm_kind=universal --m=1024 --n=1024 --k=1024 --A=f16:row --B=f16:row --C=f32:column --D=f32:column  \
                  --alpha=1 --beta=0 --split_k_mode=serial --split_k_slices=1 --batch_count=1 --raster_order=heuristic  \
                  --runtime_input_datatype_a=invalid --runtime_input_datatype_b=invalid --use_pdl=false --enable_sm90_mixed_dtype_shuffle_test=false  \
                  --swizzle_size=1 --op_class=tensorop --accum=f32 --cta_m=256 --cta_n=128 --cta_k=32 --cluster_m=1 --cluster_n=1  \
                  --cluster_k=1 --cluster_m_fallback=1 --cluster_n_fallback=1 --cluster_k_fallback=1 --stages=2 --warps_m=4  \
                  --warps_n=2 --warps_k=1 --inst_m=16 --inst_n=8 --inst_k=8 --min_cc=75 --max_cc=1024

           Bytes: 8388608  bytes
           FLOPs: 2149580800  flops
           FLOPs/Byte: 256




=============================
  Problem ID: 1

        Provider: [1;37mCUTLASS[0m
   OperationKind: [1;37mgemm[0m
       Operation: cutlass_tensorop_f16_s1688gemm_f16_256x128_32x2_nn_align8

          Status: [1;37mSuccess[0m
    Verification: [1;37mON[0m
     Disposition: [0mNot run[0m

          cuBLAS: Not run

       Arguments: --gemm_kind=universal --m=1024 --n=1024 --k=1024 --A=f16:column --B=f16:column --C=f16:column --D=f16:column  \
                  --alpha=1 --beta=0 --split_k_mode=serial --split_k_slices=1 --batch_count=1 --raster_order=heuristic  \
                  --runtime_input_datatype_a=invalid --runtime_input_datatype_b=invalid --use_pdl=false --enable_sm90_mixed_dtype_shuffle_test=false  \
                  --swizzle_size=1 --op_class=tensorop --accum=f32 --cta_m=256 --cta_n=128 --cta_k=32 --cluster_m=1 --cluster_n=1  \
                  --cluster_k=1 --cluster_m_fallback=1 --cluster_n_fallback=1 --cluster_k_fallback=1 --stages=2 --warps_m=4  \
                  --warps_n=2 --warps_k=1 --inst_m=16 --inst_n=8 --inst_k=8 --min_cc=75 --max_cc=1024

           Bytes: 6291456  bytes
           FLOPs: 2149580800  flops
           FLOPs/Byte: 341




=============================
  Problem ID: 1

        Provider: [1;37mCUTLASS[0m
   OperationKind: [1;37mgemm[0m
       Operation: cutlass_tensorop_f16_s1688gemm_f16_256x128_32x2_nt_align8

          Status: [1;37mSuccess[0m
    Verification: [1;37mON[0m
     Disposition: [0mNot run[0m

          cuBLAS: Not run

       Arguments: --gemm_kind=universal --m=1024 --n=1024 --k=1024 --A=f16:column --B=f16:row --C=f16:column --D=f16:column  \
                  --alpha=1 --beta=0 --split_k_mode=serial --split_k_slices=1 --batch_count=1 --raster_order=heuristic  \
                  --runtime_input_datatype_a=invalid --runtime_input_datatype_b=invalid --use_pdl=false --enable_sm90_mixed_dtype_shuffle_test=false  \
                  --swizzle_size=1 --op_class=tensorop --accum=f32 --cta_m=256 --cta_n=128 --cta_k=32 --cluster_m=1 --cluster_n=1  \
                  --cluster_k=1 --cluster_m_fallback=1 --cluster_n_fallback=1 --cluster_k_fallback=1 --stages=2 --warps_m=4  \
                  --warps_n=2 --warps_k=1 --inst_m=16 --inst_n=8 --inst_k=8 --min_cc=75 --max_cc=1024

           Bytes: 6291456  bytes
           FLOPs: 2149580800  flops
           FLOPs/Byte: 341




=============================
  Problem ID: 1

        Provider: [1;37mCUTLASS[0m
   OperationKind: [1;37mgemm[0m
       Operation: cutlass_tensorop_f16_s1688gemm_f16_256x128_32x2_tn_align8

          Status: [1;37mSuccess[0m
    Verification: [1;37mON[0m
     Disposition: [0mNot run[0m

          cuBLAS: Not run

       Arguments: --gemm_kind=universal --m=1024 --n=1024 --k=1024 --A=f16:row --B=f16:column --C=f16:column --D=f16:column  \
                  --alpha=1 --beta=0 --split_k_mode=serial --split_k_slices=1 --batch_count=1 --raster_order=heuristic  \
                  --runtime_input_datatype_a=invalid --runtime_input_datatype_b=invalid --use_pdl=false --enable_sm90_mixed_dtype_shuffle_test=false  \
                  --swizzle_size=1 --op_class=tensorop --accum=f32 --cta_m=256 --cta_n=128 --cta_k=32 --cluster_m=1 --cluster_n=1  \
                  --cluster_k=1 --cluster_m_fallback=1 --cluster_n_fallback=1 --cluster_k_fallback=1 --stages=2 --warps_m=4  \
                  --warps_n=2 --warps_k=1 --inst_m=16 --inst_n=8 --inst_k=8 --min_cc=75 --max_cc=1024

           Bytes: 6291456  bytes
           FLOPs: 2149580800  flops
           FLOPs/Byte: 341




=============================
  Problem ID: 1

        Provider: [1;37mCUTLASS[0m
   OperationKind: [1;37mgemm[0m
       Operation: cutlass_tensorop_f16_s1688gemm_f16_256x128_32x2_tt_align8

          Status: [1;37mSuccess[0m
    Verification: [1;37mON[0m
     Disposition: [0mNot run[0m

          cuBLAS: Not run

       Arguments: --gemm_kind=universal --m=1024 --n=1024 --k=1024 --A=f16:row --B=f16:row --C=f16:column --D=f16:column  \
                  --alpha=1 --beta=0 --split_k_mode=serial --split_k_slices=1 --batch_count=1 --raster_order=heuristic  \
                  --runtime_input_datatype_a=invalid --runtime_input_datatype_b=invalid --use_pdl=false --enable_sm90_mixed_dtype_shuffle_test=false  \
                  --swizzle_size=1 --op_class=tensorop --accum=f32 --cta_m=256 --cta_n=128 --cta_k=32 --cluster_m=1 --cluster_n=1  \
                  --cluster_k=1 --cluster_m_fallback=1 --cluster_n_fallback=1 --cluster_k_fallback=1 --stages=2 --warps_m=4  \
                  --warps_n=2 --warps_k=1 --inst_m=16 --inst_n=8 --inst_k=8 --min_cc=75 --max_cc=1024

           Bytes: 6291456  bytes
           FLOPs: 2149580800  flops
           FLOPs/Byte: 341




=============================
  Problem ID: 1

        Provider: [1;37mCUTLASS[0m
   OperationKind: [1;37mgemm[0m
       Operation: cutlass_tensorop_h1688gemm_256x128_32x2_nn_align8

          Status: [1;37mSuccess[0m
    Verification: [1;37mON[0m
     Disposition: [0mNot run[0m

          cuBLAS: Not run

       Arguments: --gemm_kind=universal --m=1024 --n=1024 --k=1024 --A=f16:column --B=f16:column --C=f16:column --D=f16:column  \
                  --alpha=1 --beta=0 --split_k_mode=serial --split_k_slices=1 --batch_count=1 --raster_order=heuristic  \
                  --runtime_input_datatype_a=invalid --runtime_input_datatype_b=invalid --use_pdl=false --enable_sm90_mixed_dtype_shuffle_test=false  \
                  --swizzle_size=1 --op_class=tensorop --accum=f16 --cta_m=256 --cta_n=128 --cta_k=32 --cluster_m=1 --cluster_n=1  \
                  --cluster_k=1 --cluster_m_fallback=1 --cluster_n_fallback=1 --cluster_k_fallback=1 --stages=2 --warps_m=4  \
                  --warps_n=2 --warps_k=1 --inst_m=16 --inst_n=8 --inst_k=8 --min_cc=75 --max_cc=1024

           Bytes: 6291456  bytes
           FLOPs: 2149580800  flops
           FLOPs/Byte: 341




=============================
  Problem ID: 1

        Provider: [1;37mCUTLASS[0m
   OperationKind: [1;37mgemm[0m
       Operation: cutlass_tensorop_h1688gemm_256x128_32x2_nt_align8

          Status: [1;37mSuccess[0m
    Verification: [1;37mON[0m
     Disposition: [0mNot run[0m

          cuBLAS: Not run

       Arguments: --gemm_kind=universal --m=1024 --n=1024 --k=1024 --A=f16:column --B=f16:row --C=f16:column --D=f16:column  \
                  --alpha=1 --beta=0 --split_k_mode=serial --split_k_slices=1 --batch_count=1 --raster_order=heuristic  \
                  --runtime_input_datatype_a=invalid --runtime_input_datatype_b=invalid --use_pdl=false --enable_sm90_mixed_dtype_shuffle_test=false  \
                  --swizzle_size=1 --op_class=tensorop --accum=f16 --cta_m=256 --cta_n=128 --cta_k=32 --cluster_m=1 --cluster_n=1  \
                  --cluster_k=1 --cluster_m_fallback=1 --cluster_n_fallback=1 --cluster_k_fallback=1 --stages=2 --warps_m=4  \
                  --warps_n=2 --warps_k=1 --inst_m=16 --inst_n=8 --inst_k=8 --min_cc=75 --max_cc=1024

           Bytes: 6291456  bytes
           FLOPs: 2149580800  flops
           FLOPs/Byte: 341




=============================
  Problem ID: 1

        Provider: [1;37mCUTLASS[0m
   OperationKind: [1;37mgemm[0m
       Operation: cutlass_tensorop_h1688gemm_256x128_32x2_tn_align8

          Status: [1;37mSuccess[0m
    Verification: [1;37mON[0m
     Disposition: [0mNot run[0m

          cuBLAS: Not run

       Arguments: --gemm_kind=universal --m=1024 --n=1024 --k=1024 --A=f16:row --B=f16:column --C=f16:column --D=f16:column  \
                  --alpha=1 --beta=0 --split_k_mode=serial --split_k_slices=1 --batch_count=1 --raster_order=heuristic  \
                  --runtime_input_datatype_a=invalid --runtime_input_datatype_b=invalid --use_pdl=false --enable_sm90_mixed_dtype_shuffle_test=false  \
                  --swizzle_size=1 --op_class=tensorop --accum=f16 --cta_m=256 --cta_n=128 --cta_k=32 --cluster_m=1 --cluster_n=1  \
                  --cluster_k=1 --cluster_m_fallback=1 --cluster_n_fallback=1 --cluster_k_fallback=1 --stages=2 --warps_m=4  \
                  --warps_n=2 --warps_k=1 --inst_m=16 --inst_n=8 --inst_k=8 --min_cc=75 --max_cc=1024

           Bytes: 6291456  bytes
           FLOPs: 2149580800  flops
           FLOPs/Byte: 341




=============================
  Problem ID: 1

        Provider: [1;37mCUTLASS[0m
   OperationKind: [1;37mgemm[0m
       Operation: cutlass_tensorop_h1688gemm_256x128_32x2_tt_align8

          Status: [1;37mSuccess[0m
    Verification: [1;37mON[0m
     Disposition: [0mNot run[0m

          cuBLAS: Not run

       Arguments: --gemm_kind=universal --m=1024 --n=1024 --k=1024 --A=f16:row --B=f16:row --C=f16:column --D=f16:column  \
                  --alpha=1 --beta=0 --split_k_mode=serial --split_k_slices=1 --batch_count=1 --raster_order=heuristic  \
                  --runtime_input_datatype_a=invalid --runtime_input_datatype_b=invalid --use_pdl=false --enable_sm90_mixed_dtype_shuffle_test=false  \
                  --swizzle_size=1 --op_class=tensorop --accum=f16 --cta_m=256 --cta_n=128 --cta_k=32 --cluster_m=1 --cluster_n=1  \
                  --cluster_k=1 --cluster_m_fallback=1 --cluster_n_fallback=1 --cluster_k_fallback=1 --stages=2 --warps_m=4  \
                  --warps_n=2 --warps_k=1 --inst_m=16 --inst_n=8 --inst_k=8 --min_cc=75 --max_cc=1024

           Bytes: 6291456  bytes
           FLOPs: 2149580800  flops
           FLOPs/Byte: 341




=============================
  Problem ID: 1

        Provider: [1;37mCUTLASS[0m
   OperationKind: [1;37mgemm[0m
       Operation: cutlass_tensorop_i8816gemm_s8_256x128_64x2_tn_align16

          Status: [1;37mSuccess[0m
    Verification: [1;37mON[0m
     Disposition: [0mNot run[0m

          cuBLAS: Not run

       Arguments: --gemm_kind=universal --m=1024 --n=1024 --k=1024 --A=s8:row --B=s8:column --C=s32:column --D=s32:column  \
                  --alpha=1 --beta=0 --split_k_mode=serial --split_k_slices=1 --batch_count=1 --raster_order=heuristic  \
                  --runtime_input_datatype_a=invalid --runtime_input_datatype_b=invalid --use_pdl=false --enable_sm90_mixed_dtype_shuffle_test=false  \
                  --swizzle_size=1 --op_class=tensorop --accum=s32 --cta_m=256 --cta_n=128 --cta_k=64 --cluster_m=1 --cluster_n=1  \
                  --cluster_k=1 --cluster_m_fallback=1 --cluster_n_fallback=1 --cluster_k_fallback=1 --stages=2 --warps_m=4  \
                  --warps_n=2 --warps_k=1 --inst_m=8 --inst_n=8 --inst_k=16 --min_cc=75 --max_cc=1024

           Bytes: 6291456  bytes
           FLOPs: 2149580800  flops
           FLOPs/Byte: 341




=============================
  Problem ID: 1

        Provider: [1;37mCUTLASS[0m
   OperationKind: [1;37mgemm[0m
       Operation: cutlass_tensorop_s8_i8816gemm_s8_256x128_64x2_tn_align16

          Status: [1;37mSuccess[0m
    Verification: [1;37mON[0m
     Disposition: [0mNot run[0m

          cuBLAS: Not run

       Arguments: --gemm_kind=universal --m=1024 --n=1024 --k=1024 --A=s8:row --B=s8:column --C=s8:column --D=s8:column  \
                  --alpha=1 --beta=0 --split_k_mode=serial --split_k_slices=1 --batch_count=1 --raster_order=heuristic  \
                  --runtime_input_datatype_a=invalid --runtime_input_datatype_b=invalid --use_pdl=false --enable_sm90_mixed_dtype_shuffle_test=false  \
                  --swizzle_size=1 --op_class=tensorop --accum=s32 --cta_m=256 --cta_n=128 --cta_k=64 --cluster_m=1 --cluster_n=1  \
                  --cluster_k=1 --cluster_m_fallback=1 --cluster_n_fallback=1 --cluster_k_fallback=1 --stages=2 --warps_m=4  \
                  --warps_n=2 --warps_k=1 --inst_m=8 --inst_n=8 --inst_k=16 --min_cc=75 --max_cc=1024

           Bytes: 3145728  bytes
           FLOPs: 2149580800  flops
           FLOPs/Byte: 683




=============================
  Problem ID: 1

        Provider: [1;37mCUTLASS[0m
   OperationKind: [1;37mgemm[0m
       Operation: cutlass_tensorop_i8816gemm_u8_256x128_64x2_tn_align16

          Status: [1;37mSuccess[0m
    Verification: [1;37mON[0m
     Disposition: [0mNot run[0m

          cuBLAS: Not run

       Arguments: --gemm_kind=universal --m=1024 --n=1024 --k=1024 --A=u8:row --B=u8:column --C=s32:column --D=s32:column  \
                  --alpha=1 --beta=0 --split_k_mode=serial --split_k_slices=1 --batch_count=1 --raster_order=heuristic  \
                  --runtime_input_datatype_a=invalid --runtime_input_datatype_b=invalid --use_pdl=false --enable_sm90_mixed_dtype_shuffle_test=false  \
                  --swizzle_size=1 --op_class=tensorop --accum=s32 --cta_m=256 --cta_n=128 --cta_k=64 --cluster_m=1 --cluster_n=1  \
                  --cluster_k=1 --cluster_m_fallback=1 --cluster_n_fallback=1 --cluster_k_fallback=1 --stages=2 --warps_m=4  \
                  --warps_n=2 --warps_k=1 --inst_m=8 --inst_n=8 --inst_k=16 --min_cc=75 --max_cc=1024

           Bytes: 6291456  bytes
           FLOPs: 2149580800  flops
           FLOPs/Byte: 341




=============================
  Problem ID: 1

        Provider: [1;37mCUTLASS[0m
   OperationKind: [1;37mgemm[0m
       Operation: cutlass_tensorop_u8_i8816gemm_u8_256x128_64x2_tn_align16

          Status: [1;37mSuccess[0m
    Verification: [1;37mON[0m
     Disposition: [0mNot run[0m

          cuBLAS: Not run

       Arguments: --gemm_kind=universal --m=1024 --n=1024 --k=1024 --A=u8:row --B=u8:column --C=u8:column --D=u8:column  \
                  --alpha=1 --beta=0 --split_k_mode=serial --split_k_slices=1 --batch_count=1 --raster_order=heuristic  \
                  --runtime_input_datatype_a=invalid --runtime_input_datatype_b=invalid --use_pdl=false --enable_sm90_mixed_dtype_shuffle_test=false  \
                  --swizzle_size=1 --op_class=tensorop --accum=s32 --cta_m=256 --cta_n=128 --cta_k=64 --cluster_m=1 --cluster_n=1  \
                  --cluster_k=1 --cluster_m_fallback=1 --cluster_n_fallback=1 --cluster_k_fallback=1 --stages=2 --warps_m=4  \
                  --warps_n=2 --warps_k=1 --inst_m=8 --inst_n=8 --inst_k=16 --min_cc=75 --max_cc=1024

           Bytes: 3145728  bytes
           FLOPs: 2149580800  flops
           FLOPs/Byte: 683




=============================
  Problem ID: 1

        Provider: [1;37mCUTLASS[0m
   OperationKind: [1;37mgemm[0m
       Operation: cutlass_tensorop_s8_i8816gemm_s8_256x128_64x2_n32t32_align16

          Status: [1;37mSuccess[0m
    Verification: [1;37mON[0m
     Disposition: [0mNot run[0m

          cuBLAS: Not run

       Arguments: --gemm_kind=universal --m=1024 --n=1024 --k=1024 --A=s8:nk32 --B=s8:tk32 --C=s8:nk32 --D=s8:nk32 --alpha=1  \
                  --beta=0 --split_k_mode=serial --split_k_slices=1 --batch_count=1 --raster_order=heuristic --runtime_input_datatype_a=invalid  \
                  --runtime_input_datatype_b=invalid --use_pdl=false --enable_sm90_mixed_dtype_shuffle_test=false --swizzle_size=1  \
                  --op_class=tensorop --accum=s32 --cta_m=256 --cta_n=128 --cta_k=64 --cluster_m=1 --cluster_n=1 --cluster_k=1  \
                  --cluster_m_fallback=1 --cluster_n_fallback=1 --cluster_k_fallback=1 --stages=2 --warps_m=4 --warps_n=2  \
                  --warps_k=1 --inst_m=8 --inst_n=8 --inst_k=16 --min_cc=75 --max_cc=1024

           Bytes: 3145728  bytes
           FLOPs: 2149580800  flops
           FLOPs/Byte: 683




=============================
  Problem ID: 1

        Provider: [1;37mCUTLASS[0m
   OperationKind: [1;37mgemm[0m
       Operation: cutlass_tensorop_u8_i8816gemm_u8_256x128_64x2_n32t32_align16

          Status: [1;37mSuccess[0m
    Verification: [1;37mON[0m
     Disposition: [0mNot run[0m

          cuBLAS: Not run

       Arguments: --gemm_kind=universal --m=1024 --n=1024 --k=1024 --A=u8:nk32 --B=u8:tk32 --C=u8:nk32 --D=u8:nk32 --alpha=1  \
                  --beta=0 --split_k_mode=serial --split_k_slices=1 --batch_count=1 --raster_order=heuristic --runtime_input_datatype_a=invalid  \
                  --runtime_input_datatype_b=invalid --use_pdl=false --enable_sm90_mixed_dtype_shuffle_test=false --swizzle_size=1  \
                  --op_class=tensorop --accum=s32 --cta_m=256 --cta_n=128 --cta_k=64 --cluster_m=1 --cluster_n=1 --cluster_k=1  \
                  --cluster_m_fallback=1 --cluster_n_fallback=1 --cluster_k_fallback=1 --stages=2 --warps_m=4 --warps_n=2  \
                  --warps_k=1 --inst_m=8 --inst_n=8 --inst_k=16 --min_cc=75 --max_cc=1024

           Bytes: 3145728  bytes
           FLOPs: 2149580800  flops
           FLOPs/Byte: 683




=============================
  Problem ID: 1

        Provider: [1;37mCUTLASS[0m
   OperationKind: [1;37mgemm[0m
       Operation: cutlass_tensorop_i8832gemm_s4_256x128_128x2_tn_align32

          Status: [1;37mSuccess[0m
    Verification: [1;37mON[0m
     Disposition: [0mNot run[0m

          cuBLAS: Not run

       Arguments: --gemm_kind=universal --m=1024 --n=1024 --k=1024 --A=s4:row --B=s4:column --C=s32:column --D=s32:column  \
                  --alpha=1 --beta=0 --split_k_mode=serial --split_k_slices=1 --batch_count=1 --raster_order=heuristic  \
                  --runtime_input_datatype_a=invalid --runtime_input_datatype_b=invalid --use_pdl=false --enable_sm90_mixed_dtype_shuffle_test=false  \
                  --swizzle_size=1 --op_class=tensorop --accum=s32 --cta_m=256 --cta_n=128 --cta_k=128 --cluster_m=1  \
                  --cluster_n=1 --cluster_k=1 --cluster_m_fallback=1 --cluster_n_fallback=1 --cluster_k_fallback=1 --stages=2  \
                  --warps_m=4 --warps_n=2 --warps_k=1 --inst_m=8 --inst_n=8 --inst_k=32 --min_cc=75 --max_cc=1024

           Bytes: 5242880  bytes
           FLOPs: 2149580800  flops
           FLOPs/Byte: 410




=============================
  Problem ID: 1

        Provider: [1;37mCUTLASS[0m
   OperationKind: [1;37mgemm[0m
       Operation: cutlass_tensorop_s4_i8832gemm_s4_256x128_128x2_tn_align32

          Status: [1;37mSuccess[0m
    Verification: [1;37mON[0m
     Disposition: [0mNot run[0m

          cuBLAS: Not run

       Arguments: --gemm_kind=universal --m=1024 --n=1024 --k=1024 --A=s4:row --B=s4:column --C=s4:column --D=s4:column  \
                  --alpha=1 --beta=0 --split_k_mode=serial --split_k_slices=1 --batch_count=1 --raster_order=heuristic  \
                  --runtime_input_datatype_a=invalid --runtime_input_datatype_b=invalid --use_pdl=false --enable_sm90_mixed_dtype_shuffle_test=false  \
                  --swizzle_size=1 --op_class=tensorop --accum=s32 --cta_m=256 --cta_n=128 --cta_k=128 --cluster_m=1  \
                  --cluster_n=1 --cluster_k=1 --cluster_m_fallback=1 --cluster_n_fallback=1 --cluster_k_fallback=1 --stages=2  \
                  --warps_m=4 --warps_n=2 --warps_k=1 --inst_m=8 --inst_n=8 --inst_k=32 --min_cc=75 --max_cc=1024

           Bytes: 1572864  bytes
           FLOPs: 2149580800  flops
           FLOPs/Byte: 1366




=============================
  Problem ID: 1

        Provider: [1;37mCUTLASS[0m
   OperationKind: [1;37mgemm[0m
       Operation: cutlass_tensorop_i8832gemm_u4_256x128_128x2_tn_align32

          Status: [1;37mSuccess[0m
    Verification: [1;37mON[0m
     Disposition: [0mNot run[0m

          cuBLAS: Not run

       Arguments: --gemm_kind=universal --m=1024 --n=1024 --k=1024 --A=u4:row --B=u4:column --C=s32:column --D=s32:column  \
                  --alpha=1 --beta=0 --split_k_mode=serial --split_k_slices=1 --batch_count=1 --raster_order=heuristic  \
                  --runtime_input_datatype_a=invalid --runtime_input_datatype_b=invalid --use_pdl=false --enable_sm90_mixed_dtype_shuffle_test=false  \
                  --swizzle_size=1 --op_class=tensorop --accum=s32 --cta_m=256 --cta_n=128 --cta_k=128 --cluster_m=1  \
                  --cluster_n=1 --cluster_k=1 --cluster_m_fallback=1 --cluster_n_fallback=1 --cluster_k_fallback=1 --stages=2  \
                  --warps_m=4 --warps_n=2 --warps_k=1 --inst_m=8 --inst_n=8 --inst_k=32 --min_cc=75 --max_cc=1024

           Bytes: 5242880  bytes
           FLOPs: 2149580800  flops
           FLOPs/Byte: 410




=============================
  Problem ID: 1

        Provider: [1;37mCUTLASS[0m
   OperationKind: [1;37mgemm[0m
       Operation: cutlass_tensorop_u4_i8832gemm_u4_256x128_128x2_tn_align32

          Status: [1;37mSuccess[0m
    Verification: [1;37mON[0m
     Disposition: [0mNot run[0m

          cuBLAS: Not run

       Arguments: --gemm_kind=universal --m=1024 --n=1024 --k=1024 --A=u4:row --B=u4:column --C=u4:column --D=u4:column  \
                  --alpha=1 --beta=0 --split_k_mode=serial --split_k_slices=1 --batch_count=1 --raster_order=heuristic  \
                  --runtime_input_datatype_a=invalid --runtime_input_datatype_b=invalid --use_pdl=false --enable_sm90_mixed_dtype_shuffle_test=false  \
                  --swizzle_size=1 --op_class=tensorop --accum=s32 --cta_m=256 --cta_n=128 --cta_k=128 --cluster_m=1  \
                  --cluster_n=1 --cluster_k=1 --cluster_m_fallback=1 --cluster_n_fallback=1 --cluster_k_fallback=1 --stages=2  \
                  --warps_m=4 --warps_n=2 --warps_k=1 --inst_m=8 --inst_n=8 --inst_k=32 --min_cc=75 --max_cc=1024

           Bytes: 1572864  bytes
           FLOPs: 2149580800  flops
           FLOPs/Byte: 1366




=============================
  Problem ID: 1

        Provider: [1;37mCUTLASS[0m
   OperationKind: [1;37mgemm[0m
       Operation: cutlass_tensorop_s4_i8832gemm_s4_256x128_128x2_n64t64_align32

          Status: [1;37mSuccess[0m
    Verification: [1;37mON[0m
     Disposition: [0mNot run[0m

          cuBLAS: Not run

       Arguments: --gemm_kind=universal --m=1024 --n=1024 --k=1024 --A=s4:nk64 --B=s4:tk64 --C=s4:nk64 --D=s4:nk64 --alpha=1  \
                  --beta=0 --split_k_mode=serial --split_k_slices=1 --batch_count=1 --raster_order=heuristic --runtime_input_datatype_a=invalid  \
                  --runtime_input_datatype_b=invalid --use_pdl=false --enable_sm90_mixed_dtype_shuffle_test=false --swizzle_size=1  \
                  --op_class=tensorop --accum=s32 --cta_m=256 --cta_n=128 --cta_k=128 --cluster_m=1 --cluster_n=1 --cluster_k=1  \
                  --cluster_m_fallback=1 --cluster_n_fallback=1 --cluster_k_fallback=1 --stages=2 --warps_m=4 --warps_n=2  \
                  --warps_k=1 --inst_m=8 --inst_n=8 --inst_k=32 --min_cc=75 --max_cc=1024

           Bytes: 1572864  bytes
           FLOPs: 2149580800  flops
           FLOPs/Byte: 1366




=============================
  Problem ID: 1

        Provider: [1;37mCUTLASS[0m
   OperationKind: [1;37mgemm[0m
       Operation: cutlass_tensorop_u4_i8832gemm_u4_256x128_128x2_n64t64_align32

          Status: [1;37mSuccess[0m
    Verification: [1;37mON[0m
     Disposition: [0mNot run[0m

          cuBLAS: Not run

       Arguments: --gemm_kind=universal --m=1024 --n=1024 --k=1024 --A=u4:nk64 --B=u4:tk64 --C=u4:nk64 --D=u4:nk64 --alpha=1  \
                  --beta=0 --split_k_mode=serial --split_k_slices=1 --batch_count=1 --raster_order=heuristic --runtime_input_datatype_a=invalid  \
                  --runtime_input_datatype_b=invalid --use_pdl=false --enable_sm90_mixed_dtype_shuffle_test=false --swizzle_size=1  \
                  --op_class=tensorop --accum=s32 --cta_m=256 --cta_n=128 --cta_k=128 --cluster_m=1 --cluster_n=1 --cluster_k=1  \
                  --cluster_m_fallback=1 --cluster_n_fallback=1 --cluster_k_fallback=1 --stages=2 --warps_m=4 --warps_n=2  \
                  --warps_k=1 --inst_m=8 --inst_n=8 --inst_k=32 --min_cc=75 --max_cc=1024

           Bytes: 1572864  bytes
           FLOPs: 2149580800  flops
           FLOPs/Byte: 1366




=============================
  Problem ID: 1

        Provider: [1;37mCUTLASS[0m
   OperationKind: [1;37mgemm[0m
       Operation: cutlass_tensorop_i88128xorgemm_b1_256x128_512x2_tn_align128

          Status: [1;37mSuccess[0m
    Verification: [1;37mON[0m
     Disposition: [0mNot run[0m

          cuBLAS: Not run

       Arguments: --gemm_kind=universal --m=1024 --n=1024 --k=1024 --A=b1:row --B=b1:column --C=s32:column --D=s32:column  \
                  --alpha=1 --beta=0 --split_k_mode=serial --split_k_slices=1 --batch_count=1 --raster_order=heuristic  \
                  --runtime_input_datatype_a=invalid --runtime_input_datatype_b=invalid --use_pdl=false --enable_sm90_mixed_dtype_shuffle_test=false  \
                  --swizzle_size=1 --op_class=tensorop --accum=s32 --cta_m=256 --cta_n=128 --cta_k=512 --cluster_m=1  \
                  --cluster_n=1 --cluster_k=1 --cluster_m_fallback=1 --cluster_n_fallback=1 --cluster_k_fallback=1 --stages=2  \
                  --warps_m=4 --warps_n=2 --warps_k=1 --inst_m=8 --inst_n=8 --inst_k=128 --min_cc=75 --max_cc=1024

           Bytes: 4456448  bytes
           FLOPs: 2149580800  flops
           FLOPs/Byte: 482




=============================
  Problem ID: 1

        Provider: [1;37mCUTLASS[0m
   OperationKind: [1;37mgemm[0m
       Operation: cutlass_tensorop_s16816gemm_f16_256x128_32x3_nn_align8

          Status: [1;37mSuccess[0m
    Verification: [1;37mON[0m
     Disposition: [0mNot run[0m

          cuBLAS: Not run

       Arguments: --gemm_kind=universal --m=1024 --n=1024 --k=1024 --A=f16:column --B=f16:column --C=f32:column --D=f32:column  \
                  --alpha=1 --beta=0 --split_k_mode=serial --split_k_slices=1 --batch_count=1 --raster_order=heuristic  \
                  --runtime_input_datatype_a=invalid --runtime_input_datatype_b=invalid --use_pdl=false --enable_sm90_mixed_dtype_shuffle_test=false  \
                  --swizzle_size=1 --op_class=tensorop --accum=f32 --cta_m=256 --cta_n=128 --cta_k=32 --cluster_m=1 --cluster_n=1  \
                  --cluster_k=1 --cluster_m_fallback=1 --cluster_n_fallback=1 --cluster_k_fallback=1 --stages=3 --warps_m=4  \
                  --warps_n=2 --warps_k=1 --inst_m=16 --inst_n=8 --inst_k=16 --min_cc=80 --max_cc=1024

           Bytes: 8388608  bytes
           FLOPs: 2149580800  flops
           FLOPs/Byte: 256




=============================
  Problem ID: 1

        Provider: [1;37mCUTLASS[0m
   OperationKind: [1;37mgemm[0m
       Operation: cutlass_tensorop_s16816gemm_f16_256x128_32x3_nt_align8

          Status: [1;37mSuccess[0m
    Verification: [1;37mON[0m
     Disposition: [0mNot run[0m

          cuBLAS: Not run

       Arguments: --gemm_kind=universal --m=1024 --n=1024 --k=1024 --A=f16:column --B=f16:row --C=f32:column --D=f32:column  \
                  --alpha=1 --beta=0 --split_k_mode=serial --split_k_slices=1 --batch_count=1 --raster_order=heuristic  \
                  --runtime_input_datatype_a=invalid --runtime_input_datatype_b=invalid --use_pdl=false --enable_sm90_mixed_dtype_shuffle_test=false  \
                  --swizzle_size=1 --op_class=tensorop --accum=f32 --cta_m=256 --cta_n=128 --cta_k=32 --cluster_m=1 --cluster_n=1  \
                  --cluster_k=1 --cluster_m_fallback=1 --cluster_n_fallback=1 --cluster_k_fallback=1 --stages=3 --warps_m=4  \
                  --warps_n=2 --warps_k=1 --inst_m=16 --inst_n=8 --inst_k=16 --min_cc=80 --max_cc=1024

           Bytes: 8388608  bytes
           FLOPs: 2149580800  flops
           FLOPs/Byte: 256




=============================
  Problem ID: 1

        Provider: [1;37mCUTLASS[0m
   OperationKind: [1;37mgemm[0m
       Operation: cutlass_tensorop_s16816gemm_f16_256x128_32x3_tn_align8

          Status: [1;37mSuccess[0m
    Verification: [1;37mON[0m
     Disposition: [0mNot run[0m

          cuBLAS: Not run

       Arguments: --gemm_kind=universal --m=1024 --n=1024 --k=1024 --A=f16:row --B=f16:column --C=f32:column --D=f32:column  \
                  --alpha=1 --beta=0 --split_k_mode=serial --split_k_slices=1 --batch_count=1 --raster_order=heuristic  \
                  --runtime_input_datatype_a=invalid --runtime_input_datatype_b=invalid --use_pdl=false --enable_sm90_mixed_dtype_shuffle_test=false  \
                  --swizzle_size=1 --op_class=tensorop --accum=f32 --cta_m=256 --cta_n=128 --cta_k=32 --cluster_m=1 --cluster_n=1  \
                  --cluster_k=1 --cluster_m_fallback=1 --cluster_n_fallback=1 --cluster_k_fallback=1 --stages=3 --warps_m=4  \
                  --warps_n=2 --warps_k=1 --inst_m=16 --inst_n=8 --inst_k=16 --min_cc=80 --max_cc=1024

           Bytes: 8388608  bytes
           FLOPs: 2149580800  flops
           FLOPs/Byte: 256




=============================
  Problem ID: 1

        Provider: [1;37mCUTLASS[0m
   OperationKind: [1;37mgemm[0m
       Operation: cutlass_tensorop_s16816gemm_f16_256x128_32x3_tt_align8

          Status: [1;37mSuccess[0m
    Verification: [1;37mON[0m
     Disposition: [0mNot run[0m

          cuBLAS: Not run

       Arguments: --gemm_kind=universal --m=1024 --n=1024 --k=1024 --A=f16:row --B=f16:row --C=f32:column --D=f32:column  \
                  --alpha=1 --beta=0 --split_k_mode=serial --split_k_slices=1 --batch_count=1 --raster_order=heuristic  \
                  --runtime_input_datatype_a=invalid --runtime_input_datatype_b=invalid --use_pdl=false --enable_sm90_mixed_dtype_shuffle_test=false  \
                  --swizzle_size=1 --op_class=tensorop --accum=f32 --cta_m=256 --cta_n=128 --cta_k=32 --cluster_m=1 --cluster_n=1  \
                  --cluster_k=1 --cluster_m_fallback=1 --cluster_n_fallback=1 --cluster_k_fallback=1 --stages=3 --warps_m=4  \
                  --warps_n=2 --warps_k=1 --inst_m=16 --inst_n=8 --inst_k=16 --min_cc=80 --max_cc=1024

           Bytes: 8388608  bytes
           FLOPs: 2149580800  flops
           FLOPs/Byte: 256




=============================
  Problem ID: 1

        Provider: [1;37mCUTLASS[0m
   OperationKind: [1;37mgemm[0m
       Operation: cutlass_tensorop_f16_s16816gemm_f16_256x128_32x3_nn_align8

          Status: [1;37mSuccess[0m
    Verification: [1;37mON[0m
     Disposition: [0mNot run[0m

          cuBLAS: Not run

       Arguments: --gemm_kind=universal --m=1024 --n=1024 --k=1024 --A=f16:column --B=f16:column --C=f16:column --D=f16:column  \
                  --alpha=1 --beta=0 --split_k_mode=serial --split_k_slices=1 --batch_count=1 --raster_order=heuristic  \
                  --runtime_input_datatype_a=invalid --runtime_input_datatype_b=invalid --use_pdl=false --enable_sm90_mixed_dtype_shuffle_test=false  \
                  --swizzle_size=1 --op_class=tensorop --accum=f32 --cta_m=256 --cta_n=128 --cta_k=32 --cluster_m=1 --cluster_n=1  \
                  --cluster_k=1 --cluster_m_fallback=1 --cluster_n_fallback=1 --cluster_k_fallback=1 --stages=3 --warps_m=4  \
                  --warps_n=2 --warps_k=1 --inst_m=16 --inst_n=8 --inst_k=16 --min_cc=80 --max_cc=1024

           Bytes: 6291456  bytes
           FLOPs: 2149580800  flops
           FLOPs/Byte: 341




=============================
  Problem ID: 1

        Provider: [1;37mCUTLASS[0m
   OperationKind: [1;37mgemm[0m
       Operation: cutlass_tensorop_f16_s16816gemm_f16_256x128_32x3_nt_align8

          Status: [1;37mSuccess[0m
    Verification: [1;37mON[0m
     Disposition: [0mNot run[0m

          cuBLAS: Not run

